Title,News Source,Time
Does Alphabet Inc Class C (GOOG) Have What it Takes to be in Your Portfolio Monday? , InvestorsObserver,"Mon, 07 Aug 2023 15:29:38 GMT"
"When the Price of Alphabet Inc Class C $GOOG Talks, People Listen ", StockTradersdaily.com,"Mon, 07 Aug 2023 17:00:00 GMT"
3 Things About Alphabet the Smartest Investors Know , Nasdaq,"Mon, 07 Aug 2023 12:00:00 GMT"
Technology news: Google will delete accounts that haven't been used in 2 years - WTVD,TV,"Mon, 07 Aug 2023 18:57:46 GMT"
"Google Parent Alphabet's Stock Top Stories: Google's AI Exploitation, Antitrust Case and UK Data Bill ", Yahoo Finance,"Mon, 07 Aug 2023 18:19:02 GMT"
Investing in AI on a Budget: 3 Undervalued Stocks You Can't Ignore , InvestorPlace,"Mon, 07 Aug 2023 23:11:36 GMT"
Regulatory and Reputational News for Alphabet Inc. (NASDAQ ... , Clayton County Register,"Mon, 07 Aug 2023 20:58:16 GMT"
Alphabets Strategic Positioning in the AI Race , Best Stocks,"Mon, 07 Aug 2023 13:15:37 GMT"
Google moves forward with plan to delete inactive accounts , CNN International,"Mon, 07 Aug 2023 16:32:00 GMT"
Is It Too Late to Buy DigitalOcean Stock? , Nasdaq,"Mon, 07 Aug 2023 11:25:00 GMT"
7 Stocks to Buy Now to Beat the Inflation Blues , InvestorPlace,"Mon, 07 Aug 2023 22:25:41 GMT"
15 Countries That Spend Most Time On Social Media , Yahoo Finance,"Mon, 07 Aug 2023 13:43:00 GMT"
Worried Your Pixel Phone Is Hacked? Here's How To Check Using ... , Investing.com UK,"Mon, 07 Aug 2023 12:36:00 GMT"
Google's 'Incognito Mode' Lawsuit Heats Up: Judge Refuses ... , Investing.com UK,"Tue, 08 Aug 2023 05:41:00 GMT"
In AI We Trust? Warren Buffett Sent 46.7% Of Berkshire Hathaway's ... , Investing.com UK,"Mon, 07 Aug 2023 21:55:00 GMT"
McCullough: What I'm Buying in a Shifting Quad Environment , Hedgeye,"Mon, 07 Aug 2023 17:46:39 GMT"
"Broadcom's Stock Top Stories: Competition from RISC-V, Qualcomm ... ", Investing.com UK,"Mon, 07 Aug 2023 16:31:00 GMT"
Saudi Aramco profits slip but sit sixteen times higher than Shell , Proactive Investors USA,"Mon, 07 Aug 2023 12:32:00 GMT"
Saudi Aramco profits slip but sit 10 times higher than Shell , Proactive Investors USA,"Mon, 07 Aug 2023 12:32:00 GMT"
1 FAANG Stock That's a No-Brainer Buy in August and 1 to Avoid , msnNOW,"Mon, 07 Aug 2023 09:06:00 GMT"
Here's Why Amazon Will Be a Profitable Short | investing.com , Investing.com,"Tue, 08 Aug 2023 04:46:00 GMT"
The 10 Stocks MarketBeat Readers Like Best , MarketBeat,"Mon, 07 Aug 2023 13:30:41 GMT"
Google Introduces Pixel Binary Transparency A Powerful Defense ... , Best Stocks,"Mon, 07 Aug 2023 12:49:33 GMT"
"Kohl's May Miss Fiscal Second-Quarter Views, Lower Full-Year ... ", msnNOW,"Mon, 07 Aug 2023 20:06:23 GMT"
What's Going On With Apple Stock Monday? , msnNOW,"Mon, 07 Aug 2023 12:26:32 GMT"
Microsoft Corp. Shares Rise 0.71% in Positive Trading Session , Clayton County Register,"Tue, 08 Aug 2023 00:52:10 GMT"
Meta Platforms Inc Enhances User Experience with New Features , Best Stocks,"Mon, 07 Aug 2023 12:25:46 GMT"
Remote work? Zoom tells employees to return to office (NASDAQ:ZM) , Seeking Alpha,"Mon, 07 Aug 2023 10:07:08 GMT"
Google moves forward with plan to delete inactive accounts , CNN,"Mon, 07 Aug 2023 16:32:00 GMT"
Technology news: Google will delete accounts that haven't been used in 2 years - WLS,TV,"Mon, 07 Aug 2023 18:43:19 GMT"
Your Gmail Inbox Could Be Shut Down Unless You Follow New ... , 2oceansvibe News,"Mon, 07 Aug 2023 14:01:04 GMT"
Inside Google Search's New Features on Consumer Data Privacy , CMSWire,"Mon, 07 Aug 2023 10:05:49 GMT"
Google will notify you of search results with your contact details , NJ.com,"Mon, 07 Aug 2023 18:55:00 GMT"
Google Will Now Proactively Scan the Web for Your Contact ... , ExtremeTech,"Mon, 07 Aug 2023 12:20:00 GMT"
$5 billion Google lawsuit over 'incognito mode' tracking moves a ... , The Verge,"Tue, 08 Aug 2023 03:22:00 GMT"
Google Search can now critique your grammar , The Verge,"Mon, 07 Aug 2023 19:30:53 GMT"
Google's Pixel 7a falls to a new all-time low at Amazon , Engadget,"Mon, 07 Aug 2023 10:45:42 GMT"
News in Canada blocked by tech giants response to law , WTVG,"Mon, 07 Aug 2023 18:08:00 GMT"
Google Cloud partner ecosystem ramps up for generative AI , TechTarget,"Mon, 07 Aug 2023 17:34:46 GMT"
Google Pixel 8 and Pixel 8 Pro versions leak - GSMArena.com news , GSMArena.com,"Tue, 08 Aug 2023 01:47:01 GMT"
Why Google Is Redesigning the UI for Chrome Downloads - MUO , MakeUseOf,"Mon, 07 Aug 2023 11:30:00 GMT"
Google Has a New Return to Office Strategy -- Keep Your ... , TheStreet,"Mon, 07 Aug 2023 15:14:21 GMT"
"Research Eyes Misconfiguration Issues At Google, Amazon and ... ", TechRepublic,"Mon, 07 Aug 2023 18:46:26 GMT"
New Warning Issued For Google’s 1.8 Billion Gmail Users , Forbes,"Mon, 07 Aug 2023 13:49:24 GMT"
"Google Analytics 4 Reports get Match Types, including regex ", Search Engine Land,"Mon, 07 Aug 2023 13:03:00 GMT"
"Google's ad growth shows signs of life, but H2 could be challenging ... ", Insider Intelligence,"Mon, 07 Aug 2023 13:13:00 GMT"
Google Ranking Algorithm Research Introduces TW-BERT , Search Engine Journal,"Mon, 07 Aug 2023 09:17:55 GMT"
"Google’s AI-powered search to show related images, videos: Details inside | Mint ", Mint,"Tue, 08 Aug 2023 05:28:01 GMT"
"Another day, another forum for responsible AI development; Google ... ", Medical Economics,"Mon, 07 Aug 2023 17:51:44 GMT"
Your Google Pixel Phone's August Update Arrived , Droid Life,"Mon, 07 Aug 2023 19:01:28 GMT"
Dangerous ChatGPT and Google Bard clones created by ‘bank-draining cybercriminals’ are being advertised on... , The US Sun,"Mon, 07 Aug 2023 16:50:29 GMT"
The Privacy Sandbox conundrum: ad tech vendors remain cautious ... , Digiday,"Tue, 08 Aug 2023 04:04:33 GMT"
3 Ways To Block Google From Indexing AI Chatbot Content , Search Engine Journal,"Mon, 07 Aug 2023 19:08:03 GMT"
Google adds Nelo to its digital wallet , Payments Dive,"Mon, 07 Aug 2023 15:40:02 GMT"
"PROOF POINTS: A spate of recent studies on the ""Google effect ... ", The Hechinger Report,"Mon, 07 Aug 2023 10:00:00 GMT"
"New Google Pixel Watch 2 leak reveals screen size, battery, and more ", Pocketnow,"Mon, 07 Aug 2023 12:00:00 GMT"
"Top places to eat in DIA, ranked by Google ", FOX 31 Denver,"Mon, 07 Aug 2023 15:03:30 GMT"
Google Merchant Center sending 'inappropriate title' warning , Search Engine Land,"Mon, 07 Aug 2023 15:00:00 GMT"
Google Play apps with 2.5M installs load ads when screen's off , BleepingComputer,"Mon, 07 Aug 2023 15:50:59 GMT"
How to remove sensitive client data from Google's index , Search Engine Land,"Mon, 07 Aug 2023 12:00:00 GMT"
Google has a super-secure new way to safeguard your Pixel phone ... , TechRadar,"Mon, 07 Aug 2023 18:22:12 GMT"
"Google, AI & Data Privacy Issue & Risks ", CMSWire,"Mon, 07 Aug 2023 13:14:03 GMT"
Google Doodle celebrates Singapore's most famous critters: otters , Insider,"Mon, 07 Aug 2023 09:27:00 GMT"
Download Google's 25th birthday wallpaper for your Pixel as deals ... , 9to5Google,"Mon, 07 Aug 2023 18:37:00 GMT"
"Google Parent Alphabet's Stock Top Stories: Google's AI Exploitation, Antitrust Case and UK Data Bill ", Yahoo Finance,"Mon, 07 Aug 2023 18:19:02 GMT"
Google Bard’s Shiba Inu Price Prediction for 2023 - Will SHIB ... - Finbold , Finance in Bold,"Mon, 07 Aug 2023 16:20:49 GMT"
Google.org grant aids entrepreneurship , News at UNG,"Mon, 07 Aug 2023 14:00:57 GMT"
BigCommerce to launch new Google Cloud AI-powered ... , Enterprise Times,"Tue, 08 Aug 2023 06:02:44 GMT"
Google Unveils Transition Plan for Lacros on Chromebooks , Fagen wasanni,"Mon, 07 Aug 2023 13:50:01 GMT"
Google opens Indie Games Fund 2023 applications for Latin ... , GamesIndustry.biz,"Mon, 07 Aug 2023 18:10:48 GMT"
Google to discuss LLM benefits for threat intelligence programs , TechTarget,"Mon, 07 Aug 2023 15:11:54 GMT"
Google’s message to iPhone users: “It’s all good” on Android side , Times of India,"Mon, 07 Aug 2023 16:31:00 GMT"
"Google Pays Apple $15,000: The Bug Bounty Shocker ", YourStory,"Mon, 07 Aug 2023 10:02:22 GMT"
Microsoft Teams vs. Google Chat: Which Is the Best Platform for ... - MUO , MakeUseOf,"Mon, 07 Aug 2023 17:46:00 GMT"
Dentsu Broadens Partnership with Google Cloud by Deploying ... - Little Black Book , LBBonline,"Mon, 07 Aug 2023 13:25:42 GMT"
Google Ads New Responsive Search Ads Guide , Search Engine Roundtable,"Mon, 07 Aug 2023 11:11:00 GMT"
Google New Publisher Center Delayed Updates Complaints , Search Engine Roundtable,"Mon, 07 Aug 2023 11:31:00 GMT"
Why This Google Maps Rival Offers the Best Navigation Software in ... , autoevolution,"Mon, 07 Aug 2023 20:18:29 GMT"
"BMW Owners Ditch Waze, Move to Google Maps Due to Android ... ", autoevolution,"Mon, 07 Aug 2023 12:17:01 GMT"
Google completely redesigns and starts trialling the Fitbit app , T3,"Tue, 08 Aug 2023 05:28:05 GMT"
Google Chromebooks Being Sold Despite No Longer Receiving ... , Fagen wasanni,"Mon, 07 Aug 2023 21:09:18 GMT"
"Google News expands to include Punjabi, Gujarati as additional languages ", The Tribune India,"Mon, 07 Aug 2023 15:23:00 GMT"
Billions of Android users warned to delete ‘impersonation apps’ that violate Google’s rules and risk your b... , The US Sun,"Mon, 07 Aug 2023 20:04:42 GMT"
Google Upcoming Cutting-Edge QR Code Scanner for Android ... , Tech Ballad,"Mon, 07 Aug 2023 16:55:48 GMT"
"Google Wear OS 4: Features, release date, and more ", Android Authority,"Mon, 07 Aug 2023 23:21:39 GMT"
How to Create Personalized Images in Bulk with Google Sheets ... , Digital Inspiration,"Mon, 07 Aug 2023 14:34:02 GMT"
Man ‘lost hearing’ after his Google Pixel 6 phone ‘exploded’ during a call , Yahoo News UK,"Mon, 07 Aug 2023 17:49:10 GMT"
Ex-Google recruiter encourages candidates to ask one question in a ... , LADbible,"Mon, 07 Aug 2023 19:41:00 GMT"
"Pacific Biosciences, GeneDx, UW Collaborate on Google-Funded ... ", GenomeWeb,"Mon, 07 Aug 2023 14:40:03 GMT"
"Steep Discounts on Amazon Kindle, Google Chromecast, and ... ", Fagen wasanni,"Tue, 08 Aug 2023 02:25:15 GMT"
"Thales, Google Cloud to Develop Generative AI Security Capabilities ", MSSP Alert,"Mon, 07 Aug 2023 17:30:26 GMT"
How ChatGPT can help you optimize your content for entities , Search Engine Land,"Mon, 07 Aug 2023 13:00:00 GMT"
"We asked Google Bard to make a $1,000 stocks portfolio - Finbold ", Finance in Bold,"Mon, 07 Aug 2023 10:25:54 GMT"
Razr+ 2023 external display calendar panel only supports Google ... , PiunikaWeb,"Mon, 07 Aug 2023 13:16:07 GMT"
Boston’s ‘cop slide’ is now on Google Maps , Boston.com,"Mon, 07 Aug 2023 15:29:00 GMT"
"Google, Huawei Accused of Copying Patented Smartwatch ... ", Bloomberg Law,"Mon, 07 Aug 2023 17:02:58 GMT"
Google's New Reading Mode: Here's How to Use It - Good e,Reader,"Mon, 07 Aug 2023 19:08:05 GMT"
Rantz: Filthy 'Jay Inslee's Campground' trolled on Google as meth spot , MyNorthwest,"Tue, 08 Aug 2023 01:17:48 GMT"
Study Reveals Microsoft's Bing AI Consumes More Electricity Than ... , Fagen wasanni,"Tue, 08 Aug 2023 02:09:17 GMT"
Is Google Still the Best Source of Information? , Digital Information World,"Mon, 07 Aug 2023 11:00:00 GMT"
How to play Google Pay's Hawker Pals National Day cashback ... , HardwareZone,"Tue, 08 Aug 2023 00:00:00 GMT"
"Google Chat walks back its announcements posting exclusivity, now ... ", Chrome Unboxed,"Mon, 07 Aug 2023 17:09:21 GMT"
How to Make Google Your Homepage , PCMag Middle East,"Mon, 07 Aug 2023 15:56:57 GMT"
New Google Business Profiles Pets Attribute (Are Dogs Allowed) , Search Engine Roundtable,"Mon, 07 Aug 2023 11:41:00 GMT"
Google launches Women Founders Fund to support AI startups in ... , Tech Funding News,"Mon, 07 Aug 2023 09:46:44 GMT"
Google May Reconsider JPEG-XL Image Support Within Chrome , Phoronix,"Mon, 07 Aug 2023 14:55:00 GMT"
Delhi HC dismisses PIL against Google India , The Economic Times,"Mon, 07 Aug 2023 18:52:24 GMT"
Amp up your gaming rig: Hisense’s 2023 144Hz mini-LED Google TVs from $600 lows ($500 off) , 9to5Toys,"Mon, 07 Aug 2023 12:46:11 GMT"
"YouTube Expands Access To Enhanced Bitrate 1080p Videos, What You Need To Know ", Hot Hardware,"Mon, 07 Aug 2023 16:40:00 GMT"
Google is testing out an airline ticket rebate program - WGN Radio , Chicago,"Mon, 07 Aug 2023 15:28:43 GMT"
'Google Maps Has Become an Eyesore' , Slashdot,"Tue, 08 Aug 2023 00:02:00 GMT"
Google won't let you turn off its annoying sign-in pop-ups - here's ... , BGR,"Mon, 07 Aug 2023 21:37:00 GMT"
Google Pixel Fold review: the start of something great , T3,"Tue, 08 Aug 2023 04:00:00 GMT"
"Google DeepMind Unveils RT-2, a Vision-Language-Action Model ... ", Fagen wasanni,"Mon, 07 Aug 2023 11:19:46 GMT"
Loyalty360 Reads: Tinder Leverages AI To Support User Profiles ... , Loyalty360,"Mon, 07 Aug 2023 15:10:32 GMT"
RICS Environmental Impact award for Google's Bay View Campus , Turner & Townsend,"Mon, 07 Aug 2023 09:28:44 GMT"
Opportunites for Black Businesses through Google , WIS News 10,"Mon, 07 Aug 2023 16:53:00 GMT"
WAGMI Games Launches WAGMI Defense Google Play Beta , InvestorsObserver,"Mon, 07 Aug 2023 09:39:00 GMT"
Geeni not working with Google Home? Here's an easy workaround , PiunikaWeb,"Tue, 08 Aug 2023 04:04:38 GMT"
Who Needs Meta or Google for News? Use ‘Really Simple ... , TheTyee.ca,"Tue, 08 Aug 2023 04:43:25 GMT"
"India House Approves Privacy Bill in Boon for Google, Meta ", Bloomberg,"Mon, 07 Aug 2023 11:04:25 GMT"
Facebook/Meta Messenger dropping SMS support in September , 9to5Google,"Tue, 08 Aug 2023 01:22:00 GMT"
Costimize Launches Advanced FinOps Platform on Google Cloud ... , Digital Journal,"Mon, 07 Aug 2023 14:18:39 GMT"
How Google is getting involved in Mongolia's Vision 2050 with ... , Chrome Unboxed,"Mon, 07 Aug 2023 19:00:08 GMT"
Instagram gets a tablet layout on Samsung foldables , 9to5Google,"Mon, 07 Aug 2023 20:03:00 GMT"
"Top rated catteries in North East Derbyshire, including Chesterfield and the Peak District – according to Google reviews ", Yahoo News UK,"Mon, 07 Aug 2023 08:34:12 GMT"
"Shortwave, the email app that works like Inbox by Gmail, finally has ... ", 9to5Google,"Mon, 07 Aug 2023 14:54:00 GMT"
Whataburger lookalike on Texas Gulf Coast operates as Whatapollo - San Antonio Express,News,"Mon, 07 Aug 2023 16:52:30 GMT"
